,"Endereço de email","Siglas e Conceituações Gerais","","Eletricidade básica","","Questionário sobre eletricidade básica.","","Tração.","","Questionário sobre tração","","Freio dinâmico.","","Questionário sobre o freio dinâmico.","","Fórum Perguntas e Respostas Pneumática","","O ar como meio de transferência de energia","","Sistema pneumáticos seus componentes","","Teste seus conhecimentos Pneumática Básica","","Sistemas pneumáticos no TUE Série 100","","Testes seus conhecimentos Pneumática S100","","TUE Série 200","","Sistemas pneumáticos nos TUEs Série 200","","Teste seus conhecimentos Pneumática S200","","Fórum Perguntas e Respostas Seset","","Bem-vindos à Segurança do Trabalho","","Segurança do Trabalho

Apresentação Incial
Obje...","","APRESENTAÇÃO INICIAL","","OBJETIVO DO CURSO PELA LEGISLAÇÃO","","OBJETIVO MORAL","","TECNOLOGIA NÃO VOLTADA A PROTEÇÃO DO SER HUMANO","","HISTÓRICO DA SEGURANÇA DO TRABALHO","","CONSCIENTIZAÇÃO: O CUIDADO COM A VIDA É O BEM MAIS IMPORTANTE","","NORMAS REGULAMENTADORAS","","NR 4 - PRINCIPAIS ATRIBUIÇÕES DO SESET","","PARADIGMA DA SEGURANÇA DO TRABALHO","","HIERARQUIA DE MEDIDAS DE CONTROLE DE RISCOS","","RISCO X PERIGO","","ELIMINAR OU MITIGAR","","COMO VOCÊ ELIMINARIA OU MITIGARIA O RISCO?","","PREVENÇÃO NO USO DE CELULAR","","Exercício Interativo - Arraste e Solte","","PREVENÇÃO","","ÁREAS RESTRITAS NA TRENSURB","","VÍDEO RISCOS NA VIA","","MENSAGEM DE ENCERRAMENTO DE TÓPICO","","Acidentes de Trabalho


Conscientização inicial...","","Experiência inicial: A importância das mãos","","Boas vindas","","Vídeo: Eu escolhi olhar para o outro lado","","O que é Segurança do Trabalho para você?","","Resposta","","Vídeo: Você é a pessoa mais importante do mundo para a sua família (Votorantim)","","Normas Regulamentadoras","","E os acidentes de trabalho?","","NBR 14280/2001","","Acidente x Incidente","","Pirâmides","","Conceito prevencionista","","Tipos de acidente","","Acidente de trajeto","","Outros acidentes de trabalho","","Causas de acidente","","Causas de acidente no Brasil","","Vídeo: Acidente com eletricidade (baixa tensão-choque elétrico)","","Vídeo Trem: Acidente com eletricidade (alta tensão-efeito térmico)","","Vídeo Subestação: Acidente com eletricidade (alta tensão-efeito térmico)","","Vídeo: Acidente em espaço confinado","","Causas de acidente na Trensurb","","Consequências dos acidentes","","Vídeo: Relatos de acidentes","","Documentos: RAT x CAT","","Preenchimento do RAT","","Auxílio-doença acidentário","","Prevenção de acidentes","","Documento: Relatório de Análise de Acidente de Trabalho","","Número de acidentes na Trensurb","","Vídeo: Número de acidentes (Ypê)","","Número de acidentes no Brasil e no RS","","Vídeo: O ponto (Personare)","","Encerramento: A Lição do Rato e a responsabilidade de todos","","Vídeo: O farol da responsabilidade","","O que é Segurança do Trabalho para você?","","Equipamentos de Proteção Individual - EPI (copiado)","","Equipamento de Proteção Individual - EPI","","COMO UTILIZAR A MÁSCARA","","Exercícios - Tópico EPI","","Fórum Perguntas e Respostas - Via Permanente","","Organograma SEVIP","","Atividades do SEVIP","","Introdução de via permanente","","Elementos da via Permanente","","Aparelho de Mudança de Via (AMV)","","Para-choque (batente de via)","","Vias do Pátio Humaitá","","Atividade de aprendizado - Conceitos de via permanente","","Procedimento de inspeção visual na via permanente","","Defeitos da Via Permanente","","Atividade de aprendizado - Inspeção de via","","Fórum Perguntas e Respostas - Rede Aérea","","Conceitos e definições","","Modalidade de rede aérea","","Regularidade e funcionalidade","","Desenho esquemático da rede aérea","","Elementos Constitutivos da Rede Aérea","","Alimentação da rede aérea da via principal","","Alimentação da rede aérea das vias de serviço ou do pátio","","Alimentação e secionamento em 3KVcc","","Esquema de alimentação típica da rede aérea","","Programação de serviços noturnos","","Atividades com acesso à via","","Veículos utilizados na manutenção da rede aérea","","Teste seus conhecimentos","","Organograma Sesin","","Atribuições","","Fluxograma de manutenção Sesin","","Gráfico de falhas Sesin","","Sopa de letrinhas (GLOSSÁRIO)","","Configuração geral do sistema de sinalização","","Controle de tráfego centralizado (CTC)","","Sistema de controle de tráfego e energia (SCTE)","","Controle de tráfego local (PCL)","","Sistema de intertravamento","","Circuitos de via (CDV)","","Diagrama simplificado de um circuito de via","","Equipamentos de sinalização de via","","Junta isolante cola (JIC)","","Sinaleiro de via","","Bobina de impedância (BI)","","Máquinas de chaves (MCH)","","Composição do sistema de sinalização de segurança","","Sinalização de campo","","ATS - Sistema de controle automático de parada","","ATC - Sistema de controle automático de velocidade","","Sinal 'X'","","Sinalização de bordo","","Sinalização de bordo do TUE","","Cabina do trem","","Diagrama dos equipamentos de bordo","","Receptor  ATC","","Receptor ATS","","Comparador de velocidade","","Objetivo","","Posicionamento","","Tipos","","Travamento MCH Kyosan Pátio","","Travamento MCH Kyosan Via Principal","","Travamento MCH JEA 73 Bombardier (UNISINOS / SÃO LEOPOLDO)","","Operação de máquina JEA 73 (UNISINOS / SÃO LEOPOLDO)","","Travamento máquina de chave expansão NH","","Considerações finais","","Vamos treinar ?","","Fórum Perguntas e Respostas - Equipamentos Embarcados","","Equipamento embarcado","","Questionário sobre equipamento embarcado","","Tração e Frenagem Reostática","","PACIS","","Material Rodante Mecânica","","Apostila Material Mecânica","","Material Rodante Elétrica","","Apostila Material Elétrico","","Material Rodante Pneumática","","Apostila Material Pneumático","","Vídeo Equipamentos Série 100","","Teste seus conhecimentos","","Material Rodante","","Apostila Série 200","","Vídeo Equipamentos Série 200","","Teste seus conhecimentos","","Fórum - Vamos tirar dúvidas aqui ","","Preparação e Revisão TUE S100","","Cabine Interativa S100","","Hora de exercitar l","","Apostila Série 100","","Preparação e Revisão TUE S200","","Cabine Interativa S200","","Hora de exercitar ll","","Lista de Trajetos do TUE Série 200","","Apostila Série 200","","NPG-OPE-105: Utilização dos sistemas de rádio e telefonia","","NPG-OPE-107: Controle de acesso as áreas operacionais","","PRO-SETRA-001: Emissão de PAs nos Trens","","PRO-SETRA-003: Condução de Trens","","NPG 109 - Movimentação de TUE nas vias do pátio","","NPG-OPE-115: Sistema de sinalização de via e  embarcado nos trens ","","NPG-OPE-122: Procedimentos para marcha a vista","","PRO-SETRA-002: Regulamentação de limite de velocidade aplicada em TUEs da passagem por Empregados em Trânsito na Via","","NPG-OPE-108: Atropelamento de pessoas por TUE  em via permanente","","NPG-OPE-1008: Evacuação de trem na via","","Manual de Rotinas SETRA","","Preparação do TUE para limpeza","","Movimentação de TUE para via não sinalizada","","Manobra de TUE para VP 16","","Operação da máquina de chave manual","","Entrada de TUE no depósito SEOFI","","Acoplamento mecânico TUE série 100","","Acoplamento elétrico e pneumático TUE série 100 ","","Infográfico Acoplamento série 100","","Acoplamento TUE série 200","","Exercícios Normas e Rotinas","","Simulado","2021-01-06 16:17:00","SESET","","MATERIAL RODANTE S100","","MATERIAL RODANTE S200","","PREPARAÇÃO DE TRENS","","Normas, Procedimentos e Rotinas Operacionais","","Eletricidade Básica","","Sistemas pneumáticos no TUE Série 100","","Sistemas pneumáticos nos TUEs Série 200","","Via Permanente","","REDE AÉREA","","SISTEMA DE SINALIZAÇÃO","","EQUIPAMENTOS ELÉTRICOS, ELETRÔNICOS EMBARCADOS","","Avaliação de Satisfação - Modalidade EAD","","Emissão de Certificado","","PROVA FINAL","","Saiba Mais","","Frenagem S100","","Frenagem S200","","Dica de uso de Homem Morto S200",""
"Carlos Alberto Batista dos Santos","carlosabs17@gmail.com","Não concluído","","Não concluído","","Não concluído","","Não concluído","","Não concluído","","Não concluído","","Não concluído","","Não concluído","","Não concluído","","Não concluído","","Não concluído","","Não concluído","","Não concluído","","Não concluído","","Não concluído","","Não concluído","","Não concluído","","Não concluído","","Não concluído","","Não concluído","","Não concluído","","Não concluído","","Não concluído","","Não concluído","","Não concluído","","Não concluído","","Não concluído","","Não concluído","","Não concluído","","Não concluído","","Não concluído","","Não concluído","","Não concluído","","Não concluído","","Não concluído","","Não concluído","","Não concluído","","Não concluído","","Não concluído","","Não concluído","","Não concluído","","Não concluído","","Não concluído","","Não concluído","","Não concluído","","Não concluído","","Não concluído","","Não concluído","","Não concluído","","Não concluído","","Não concluído","","Não concluído","","Não concluído","","Não concluído","","Não concluído","","Não concluído","","Não concluído","","Não concluído","","Não concluído","","Não concluído","","Não concluído","","Não concluído","","Não concluído","","Não concluído","","Não concluído","","Não concluído","","Não concluído","","Não concluído","","Não concluído","","Não concluído","","Não concluído","","Não concluído","","Não concluído","","Não concluído","","Não concluído","","Não concluído","","Não concluído","","Não concluído","","Não concluído","","Não concluído","","Não concluído","","Não concluído","","Não concluído","","Não concluído","","Não concluído","","Não concluído","","Não concluído","","Não concluído","","Não concluído","","Não concluído","","Não concluído","","Não concluído","","Não concluído","","Não concluído","","Não concluído","","Não concluído","","Não concluído","","Não concluído","","Não concluído","","Não concluído","","Não concluído","","Não concluído","","Não concluído","","Não concluído","","Não concluído","","Não concluído","","Não concluído","","Não concluído","","Não concluído","","Não concluído","","Não concluído","","Não concluído","","Não concluído","","Não concluído","","Não concluído","","Não concluído","","Não concluído","","Não concluído","","Não concluído","","Não concluído","","Não concluído","","Não concluído","","Não concluído","","Não concluído","","Não concluído","","Não concluído","","Não concluído","","Não concluído","","Não concluído","","Não concluído","","Não concluído","","Não concluído","","Não concluído","","Não concluído","","Não concluído","","Não concluído","","Não concluído","","Não concluído","","Não concluído","","Não concluído","","Não concluído","","Não concluído","","Não concluído","","Não concluído","","Não concluído","","Não concluído","","Não concluído","","Não concluído","","Não concluído","","Não concluído","","Não concluído","","Não concluído","","Não concluído","","Não concluído","","Não concluído","","Não concluído","","Não concluído","","Não concluído","","Não concluído","","Não concluído","","Não concluído","","Não concluído","","Não concluído","","Não concluído","","Não concluído","","Não concluído","","Não concluído","","Não concluído","","Não concluído","","Não concluído","","Não concluído","","Não concluído","","Não concluído","","Não concluído","","Não concluído","","Não concluído","","Não concluído","","Não concluído","","Não concluído","","Não concluído","","Não concluído","","Não concluído","","Não concluído","","Não concluído","","Não concluído","","Não concluído","","Não concluído","","Não concluído","","Não concluído","","Não concluído","","Não concluído","","Não concluído","","Não concluído","","Não concluído","","Não concluído","","Não concluído","","Não concluído","","Não concluído","","Não concluído","","Não concluído","","Não concluído","","Não concluído","","Não concluído","","Não concluído","","Não concluído","","Não concluído","","Não concluído","","Não concluído","","Não concluído","","Não concluído","","Não concluído","","Não concluído",""
"Carlos Alberto de Oliveira Barcellos","cabalaco@gmail.com","Não concluído","","Não concluído","","Não concluído","","Não concluído","","Não concluído","","Não concluído","","Não concluído","","Não concluído","","Não concluído","","Não concluído","","Não concluído","","Não concluído","","Não concluído","","Não concluído","","Não concluído","","Não concluído","","Não concluído","","Não concluído","","Não concluído","","Não concluído","","Não concluído","","Não concluído","","Não concluído","","Não concluído","","Não concluído","","Não concluído","","Não concluído","","Não concluído","","Não concluído","","Não concluído","","Não concluído","","Não concluído","","Não concluído","","Não concluído","","Não concluído","","Não concluído","","Não concluído","","Não concluído","","Não concluído","","Não concluído","","Não concluído","","Não concluído","","Não concluído","","Não concluído","","Não concluído","","Não concluído","","Não concluído","","Não concluído","","Não concluído","","Não concluído","","Não concluído","","Não concluído","","Não concluído","","Não concluído","","Não concluído","","Não concluído","","Não concluído","","Não concluído","","Não concluído","","Não concluído","","Não concluído","","Não concluído","","Não concluído","","Não concluído","","Não concluído","","Não concluído","","Não concluído","","Não concluído","","Não concluído","","Não concluído","","Não concluído","","Não concluído","","Não concluído","","Não concluído","","Não concluído","","Não concluído","","Não concluído","","Não concluído","","Não concluído","","Não concluído","","Não concluído","","Não concluído","","Não concluído","","Não concluído","","Não concluído","","Não concluído","","Não concluído","","Não concluído","","Não concluído","","Não concluído","","Não concluído","","Não concluído","","Não concluído","","Não concluído","","Não concluído","","Não concluído","","Não concluído","","Não concluído","","Não concluído","","Não concluído","","Não concluído","","Não concluído","","Não concluído","","Não concluído","","Não concluído","","Não concluído","","Não concluído","","Não concluído","","Não concluído","","Não concluído","","Não concluído","","Não concluído","","Não concluído","","Não concluído","","Não concluído","","Não concluído","","Não concluído","","Não concluído","","Não concluído","","Não concluído","","Não concluído","","Não concluído","","Não concluído","","Não concluído","","Não concluído","","Não concluído","","Não concluído","","Não concluído","","Não concluído","","Não concluído","","Não concluído","","Não concluído","","Não concluído","","Não concluído","","Não concluído","","Não concluído","","Não concluído","","Não concluído","","Não concluído","","Não concluído","","Não concluído","","Não concluído","","Não concluído","","Não concluído","","Não concluído","","Não concluído","","Não concluído","","Não concluído","","Não concluído","","Não concluído","","Não concluído","","Não concluído","","Não concluído","","Não concluído","","Não concluído","","Não concluído","","Não concluído","","Não concluído","","Não concluído","","Não concluído","","Não concluído","","Não concluído","","Não concluído","","Não concluído","","Não concluído","","Não concluído","","Não concluído","","Não concluído","","Não concluído","","Não concluído","","Não concluído","","Não concluído","","Não concluído","","Não concluído","","Não concluído","","Não concluído","","Não concluído","","Não concluído","","Não concluído","","Não concluído","","Não concluído","","Não concluído","","Não concluído","","Não concluído","","Não concluído","","Não concluído","","Não concluído","","Não concluído","","Não concluído","","Não concluído","","Não concluído","","Não concluído","","Não concluído","","Não concluído","","Não concluído","","Não concluído","","Não concluído","","Não concluído","","Não concluído","","Não concluído","","Não concluído","","Não concluído","","Não concluído","","Não concluído","","Não concluído","","Não concluído","","Não concluído","","Não concluído","","Não concluído","","Não concluído","","Não concluído","","Não concluído",""
"Carlos Alberto Moreira Nogueira","nogueira.pff@gmail.com","Não concluído","","Não concluído","","Não concluído","","Não concluído","","Não concluído","","Não concluído","","Não concluído","","Não concluído","","Não concluído","","Não concluído","","Não concluído","","Não concluído","","Não concluído","","Não concluído","","Não concluído","","Não concluído","","Não concluído","","Não concluído","","Não concluído","","Não concluído","","Não concluído","","Não concluído","","Não concluído","","Não concluído","","Não concluído","","Não concluído","","Não concluído","","Não concluído","","Não concluído","","Não concluído","","Não concluído","","Não concluído","","Não concluído","","Não concluído","","Não concluído","","Não concluído","","Não concluído","","Não concluído","","Não concluído","","Não concluído","","Não concluído","","Não concluído","","Não concluído","","Não concluído","","Não concluído","","Não concluído","","Não concluído","","Não concluído","","Não concluído","","Não concluído","","Não concluído","","Não concluído","","Não concluído","","Não concluído","","Não concluído","","Não concluído","","Não concluído","","Não concluído","","Não concluído","","Não concluído","","Não concluído","","Não concluído","","Não concluído","","Não concluído","","Não concluído","","Não concluído","","Não concluído","","Não concluído","","Não concluído","","Não concluído","","Não concluído","","Não concluído","","Não concluído","","Não concluído","","Não concluído","","Não concluído","","Não concluído","","Não concluído","","Não concluído","","Não concluído","","Não concluído","","Não concluído","","Não concluído","","Não concluído","","Não concluído","","Não concluído","","Não concluído","","Não concluído","","Não concluído","","Não concluído","","Não concluído","","Não concluído","","Não concluído","","Não concluído","","Não concluído","","Não concluído","","Não concluído","","Não concluído","","Não concluído","","Não concluído","","Não concluído","","Não concluído","","Não concluído","","Não concluído","","Não concluído","","Não concluído","","Não concluído","","Não concluído","","Não concluído","","Não concluído","","Não concluído","","Não concluído","","Não concluído","","Não concluído","","Não concluído","","Não concluído","","Não concluído","","Não concluído","","Não concluído","","Não concluído","","Não concluído","","Não concluído","","Não concluído","","Não concluído","","Não concluído","","Não concluído","","Não concluído","","Não concluído","","Não concluído","","Não concluído","","Não concluído","","Não concluído","","Não concluído","","Não concluído","","Não concluído","","Não concluído","","Não concluído","","Não concluído","","Não concluído","","Não concluído","","Não concluído","","Não concluído","","Não concluído","","Não concluído","","Não concluído","","Não concluído","","Não concluído","","Não concluído","","Não concluído","","Não concluído","","Não concluído","","Não concluído","","Não concluído","","Não concluído","","Não concluído","","Não concluído","","Não concluído","","Não concluído","","Não concluído","","Não concluído","","Não concluído","","Não concluído","","Não concluído","","Não concluído","","Não concluído","","Não concluído","","Não concluído","","Não concluído","","Não concluído","","Não concluído","","Não concluído","","Não concluído","","Não concluído","","Não concluído","","Não concluído","","Não concluído","","Não concluído","","Não concluído","","Não concluído","","Não concluído","","Não concluído","","Não concluído","","Não concluído","","Não concluído","","Não concluído","","Não concluído","","Não concluído","","Não concluído","","Não concluído","","Não concluído","","Não concluído","","Não concluído","","Não concluído","","Não concluído","","Não concluído","","Não concluído","","Não concluído","","Não concluído","","Não concluído","","Não concluído","","Não concluído","","Não concluído","","Não concluído","","Não concluído","","Não concluído","","Não concluído","","Não concluído","","Não concluído","","Não concluído","","Não concluído","","Não concluído","","Não concluído",""
